{
  "$schema": "../../../schemas/product-release.schema.json",
  "id": "duelist-pack-special-edition",
  "code": "DPK",
  "name": "Duelist Pack: Special Edition",
  "kind": "other",
  "release_events": [
    {
      "territory": "tcg-na",
      "date": "2006-03-09",
      "precision": "day",
      "status": "reported",
      "kind": "retail",
      "sources": [
        "yugipedia-set-pages",
        "ygoprodeck-api"
      ]
    }
  ],
  "printings": [
    {
      "passcode": 48115277,
      "name": "Blockman",
      "numbers": [
        "DPK-ENSE1"
      ]
    },
    {
      "passcode": 54762426,
      "name": "Treasure Map",
      "numbers": [
        "DPK-ENSE2"
      ]
    },
    {
      "passcode": 81167171,
      "name": "Hero Spirit",
      "numbers": [
        "DPK-ENSE3"
      ]
    }
  ],
  "sources": [
    "ygoprodeck-api",
    "yugipedia-set-pages"
  ],
  "notes": "Dates from Yugipedia set page 'Duelist Pack: Special Edition'; printings from the YGOPRODeck bulk dump."
}
