{
  "$schema": "../../../schemas/product-release.schema.json",
  "id": "starter-deck-kaiba-evolution",
  "code": "SKE",
  "name": "Starter Deck: Kaiba Evolution",
  "kind": "starter",
  "release_events": [
    {
      "territory": "tcg-eu",
      "date": "2004-03-01",
      "precision": "month",
      "status": "reported",
      "kind": "retail",
      "sources": [
        "yugipedia-set-pages"
      ]
    },
    {
      "territory": "tcg",
      "date": "2004-03-01",
      "precision": "day",
      "status": "reported",
      "kind": "retail",
      "sources": [
        "yugipedia-set-pages",
        "ygoprodeck-api"
      ]
    }
  ],
  "printings": [
    {
      "passcode": 1184620,
      "name": "Kojikocy",
      "numbers": [
        "SKE-005"
      ]
    },
    {
      "passcode": 1784619,
      "name": "Uraby",
      "numbers": [
        "SKE-006"
      ]
    },
    {
      "passcode": 2833249,
      "name": "D. Tribe",
      "numbers": [
        "SKE-050"
      ]
    },
    {
      "passcode": 4031928,
      "name": "Change of Heart",
      "numbers": [
        "SKE-032"
      ]
    },
    {
      "passcode": 4206964,
      "name": "Trap Hole",
      "numbers": [
        "SKE-042"
      ]
    },
    {
      "passcode": 5053103,
      "name": "Battle Ox",
      "numbers": [
        "SKE-002"
      ]
    },
    {
      "passcode": 7089711,
      "name": "Hane-Hane",
      "numbers": [
        "SKE-019"
      ]
    },
    {
      "passcode": 9786492,
      "name": "White Dragon Ritual",
      "numbers": [
        "SKE-025"
      ]
    },
    {
      "passcode": 10202894,
      "name": "Skull Red Bird",
      "numbers": [
        "SKE-010"
      ]
    },
    {
      "passcode": 14531242,
      "name": "Opticlops",
      "numbers": [
        "SKE-012"
      ]
    },
    {
      "passcode": 17444133,
      "name": "Kaiser Sea Horse",
      "numbers": [
        "SKE-015"
      ]
    },
    {
      "passcode": 17658803,
      "name": "Luster Dragon #2",
      "numbers": [
        "SKE-014"
      ]
    },
    {
      "passcode": 17985575,
      "name": "Lord of D.",
      "numbers": [
        "SKE-016"
      ]
    },
    {
      "passcode": 19159413,
      "name": "De-Spell",
      "numbers": [
        "SKE-028"
      ]
    },
    {
      "passcode": 19523799,
      "name": "Ookazi",
      "numbers": [
        "SKE-026"
      ]
    },
    {
      "passcode": 22046459,
      "name": "Megamorph",
      "numbers": [
        "SKE-037"
      ]
    },
    {
      "passcode": 24068492,
      "name": "Just Desserts",
      "numbers": [
        "SKE-043"
      ]
    },
    {
      "passcode": 24611934,
      "name": "Ryu-Kishin Powered",
      "numbers": [
        "SKE-008"
      ]
    },
    {
      "passcode": 29267084,
      "name": "Shadow Spell",
      "numbers": [
        "SKE-041"
      ]
    },
    {
      "passcode": 43973174,
      "name": "The Flute of Summoning Dragon",
      "numbers": [
        "SKE-031"
      ]
    },
    {
      "passcode": 46461247,
      "name": "Trap Master",
      "numbers": [
        "SKE-018"
      ]
    },
    {
      "passcode": 50913601,
      "name": "Mountain",
      "numbers": [
        "SKE-034"
      ]
    },
    {
      "passcode": 54098121,
      "name": "Mysterious Puppeteer",
      "numbers": [
        "SKE-017"
      ]
    },
    {
      "passcode": 60082869,
      "name": "Dust Tornado",
      "numbers": [
        "SKE-045"
      ]
    },
    {
      "passcode": 62397231,
      "name": "Hyozanryu",
      "numbers": [
        "SKE-011"
      ]
    },
    {
      "passcode": 62867251,
      "name": "Light of Intervention",
      "numbers": [
        "SKE-046"
      ]
    },
    {
      "passcode": 66788016,
      "name": "Fissure",
      "numbers": [
        "SKE-027"
      ]
    },
    {
      "passcode": 67724379,
      "name": "Koumori Dragon",
      "numbers": [
        "SKE-003"
      ]
    },
    {
      "passcode": 67957315,
      "name": "Spirit Ryu",
      "numbers": [
        "SKE-023"
      ]
    },
    {
      "passcode": 68005187,
      "name": "Soul Exchange",
      "numbers": [
        "SKE-033"
      ]
    },
    {
      "passcode": 68516705,
      "name": "Mystic Horseman",
      "numbers": [
        "SKE-007"
      ]
    },
    {
      "passcode": 70046172,
      "name": "Rush Recklessly",
      "numbers": [
        "SKE-036"
      ]
    },
    {
      "passcode": 70344351,
      "name": "Riryoku Field",
      "numbers": [
        "SKE-048"
      ]
    },
    {
      "passcode": 70828912,
      "name": "Premature Burial",
      "numbers": [
        "SKE-039"
      ]
    },
    {
      "passcode": 71044499,
      "name": "Nobleman of Crossout",
      "numbers": [
        "SKE-038"
      ]
    },
    {
      "passcode": 73398797,
      "name": "Paladin of White Dragon",
      "numbers": [
        "SKE-024"
      ]
    },
    {
      "passcode": 78010363,
      "name": "Witch of the Black Forest",
      "numbers": [
        "SKE-020"
      ]
    },
    {
      "passcode": 79759861,
      "name": "Tribute to The Doomed",
      "numbers": [
        "SKE-035"
      ]
    },
    {
      "passcode": 79870141,
      "name": "Mad Sword Beast",
      "numbers": [
        "SKE-022"
      ]
    },
    {
      "passcode": 80163754,
      "name": "Burst Breath",
      "numbers": [
        "SKE-049"
      ]
    },
    {
      "passcode": 81820689,
      "name": "The Inexperienced Spy",
      "numbers": [
        "SKE-030"
      ]
    },
    {
      "passcode": 83011277,
      "name": "Mystic Tomato",
      "numbers": [
        "SKE-021"
      ]
    },
    {
      "passcode": 83764718,
      "name": "Monster Reborn",
      "numbers": [
        "SKE-029"
      ]
    },
    {
      "passcode": 83968380,
      "name": "Jar of Greed",
      "numbers": [
        "SKE-047"
      ]
    },
    {
      "passcode": 89631139,
      "name": "Blue-Eyes White Dragon",
      "numbers": [
        "SKE-001"
      ]
    },
    {
      "passcode": 91939608,
      "name": "Rogue Doll",
      "numbers": [
        "SKE-004"
      ]
    },
    {
      "passcode": 93346024,
      "name": "The Dragon Dwelling in the Cave",
      "numbers": [
        "SKE-013"
      ]
    },
    {
      "passcode": 97590747,
      "name": "La Jinn the Mystical Genie of the Lamp",
      "numbers": [
        "SKE-009"
      ]
    },
    {
      "passcode": 97687912,
      "name": "Fairy Meteor Crush",
      "numbers": [
        "SKE-040"
      ]
    },
    {
      "passcode": 98299011,
      "name": "Gift of The Mystical Elf",
      "numbers": [
        "SKE-044"
      ]
    }
  ],
  "sources": [
    "ygoprodeck-api",
    "yugipedia-set-pages"
  ],
  "notes": "Dates from Yugipedia set page 'Starter Deck: Kaiba Evolution'; printings from the YGOPRODeck bulk dump."
}
