{
  "$schema": "../../../schemas/product-release.schema.json",
  "id": "swedish-shonen-jump-2004-issue-2-promotional-card",
  "code": "JMP",
  "name": "Swedish Shonen Jump 2004, Issue 2 promotional card",
  "kind": "promo-subscription",
  "release_events": [
    {
      "territory": "tcg-eu",
      "date": "2004-11-01",
      "precision": "month",
      "status": "reported",
      "kind": "retail",
      "sources": [
        "yugipedia-set-pages"
      ]
    }
  ],
  "printings": [
    {
      "passcode": 89631139,
      "name": "Blue-Eyes White Dragon",
      "numbers": [
        "JMP-EN001"
      ]
    }
  ],
  "sources": [
    "ygoprodeck-api",
    "yugipedia-set-pages"
  ],
  "notes": "Dates from Yugipedia set page 'Swedish Shonen Jump 2004, Issue 2 promotional card'; printings from the YGOPRODeck bulk dump."
}
