{
  "$schema": "../../../schemas/product-release.schema.json",
  "id": "shonen-jump-vol-7-issue-11-promotional-card",
  "code": "JUMP",
  "name": "Shonen Jump Vol. 7, Issue 11 promotional card",
  "kind": "promo-subscription",
  "release_events": [
    {
      "territory": "tcg",
      "date": "2009-11-01",
      "precision": "day",
      "status": "reported",
      "kind": "retail",
      "sources": [
        "ygoprodeck-api"
      ]
    }
  ],
  "printings": [
    {
      "passcode": 60417395,
      "name": "Darkness Neosphere",
      "numbers": [
        "JUMP-EN036"
      ]
    }
  ],
  "sources": [
    "ygoprodeck-api"
  ],
  "notes": "No usable Yugipedia date; single unspecified-territory date from the YGOPRODeck bulk dump."
}
