{
  "$schema": "../../../schemas/product-release.schema.json",
  "id": "yu-gi-oh-power-of-chaos-joey-the-passion-promotional-cards",
  "code": "PCJ",
  "name": "Yu-Gi-Oh! Power of Chaos: Joey the Passion promotional cards",
  "kind": "promo-other",
  "release_events": [
    {
      "territory": "tcg",
      "date": "2004-06-29",
      "precision": "day",
      "status": "reported",
      "kind": "retail",
      "sources": [
        "yugipedia-set-pages",
        "ygoprodeck-api"
      ]
    }
  ],
  "printings": [
    {
      "passcode": 22537443,
      "name": "Sebek's Blessing",
      "numbers": [
        "PCJ-EN002"
      ]
    },
    {
      "passcode": 61405855,
      "name": "Sword of Dragon's Soul",
      "numbers": [
        "PCJ-EN003"
      ]
    },
    {
      "passcode": 74677422,
      "name": "Red-Eyes Black Dragon",
      "numbers": [
        "PCJ-EN001"
      ]
    }
  ],
  "sources": [
    "ygoprodeck-api",
    "yugipedia-set-pages"
  ],
  "notes": "Dates from Yugipedia set page 'Yu-Gi-Oh! Power of Chaos: Joey the Passion promotional cards'; printings from the YGOPRODeck bulk dump."
}
