{
  "$schema": "../../../schemas/product-release.schema.json",
  "id": "shonen-jump-vol-6-issue-12-promotional-card",
  "code": "JUMP",
  "name": "Shonen Jump Vol. 6, Issue 12 promotional card",
  "kind": "promo-subscription",
  "release_events": [
    {
      "territory": "tcg-na",
      "date": "2008-11-05",
      "precision": "day",
      "status": "reported",
      "kind": "retail",
      "sources": [
        "yugipedia-set-pages",
        "ygoprodeck-api"
      ]
    }
  ],
  "printings": [
    {
      "passcode": 5861892,
      "name": "Arcana Force EX - The Light Ruler",
      "numbers": [
        "JUMP-EN027"
      ]
    }
  ],
  "sources": [
    "ygoprodeck-api",
    "yugipedia-set-pages"
  ],
  "notes": "Dates from Yugipedia set page 'Shonen Jump Vol. 6, Issue 12 promotional card'; printings from the YGOPRODeck bulk dump."
}
