{
  "$schema": "../../../schemas/product-release.schema.json",
  "id": "hobby-league-1-participation-cards-a",
  "code": "HL1",
  "name": "Hobby League 1 participation cards A",
  "kind": "promo-other",
  "release_events": [
    {
      "territory": "tcg-na",
      "date": "2004-10-01",
      "precision": "day",
      "status": "reported",
      "kind": "retail",
      "sources": [
        "yugipedia-set-pages",
        "ygoprodeck-api"
      ]
    }
  ],
  "printings": [
    {
      "passcode": 61831093,
      "name": "Greenkappa",
      "numbers": [
        "HL1-EN002"
      ]
    },
    {
      "passcode": 99510761,
      "name": "Lord of the Lamp",
      "numbers": [
        "HL1-EN001"
      ]
    }
  ],
  "sources": [
    "ygoprodeck-api",
    "yugipedia-set-pages"
  ],
  "notes": "Dates from Yugipedia set page 'Hobby League 1 participation cards A'; printings from the YGOPRODeck bulk dump."
}
