{
  "$schema": "../../../schemas/product-release.schema.json",
  "id": "absolute-powerforce-sneak-peek-participation-card",
  "code": "ABPF",
  "name": "Absolute Powerforce Sneak Peek Participation Card",
  "kind": "promo-other",
  "release_events": [
    {
      "territory": "tcg",
      "date": "2010-02-06",
      "precision": "day",
      "status": "reported",
      "kind": "retail",
      "sources": [
        "yugipedia-set-pages",
        "ygoprodeck-api"
      ]
    }
  ],
  "printings": [
    {
      "passcode": 3381441,
      "name": "Gravekeeper's Priestess",
      "numbers": [
        "ABPF-ENSP1"
      ]
    }
  ],
  "sources": [
    "ygoprodeck-api",
    "yugipedia-set-pages"
  ],
  "notes": "Dates from Yugipedia set page 'Absolute Powerforce Sneak Peek Participation Card'; printings from the YGOPRODeck bulk dump."
}
