{
  "$schema": "../../../schemas/product-release.schema.json",
  "id": "phantom-darkness-special-edition",
  "code": "PTDN",
  "name": "Phantom Darkness: Special Edition",
  "kind": "other",
  "release_events": [
    {
      "territory": "tcg-na",
      "date": "2008-03-12",
      "precision": "day",
      "status": "reported",
      "kind": "retail",
      "sources": [
        "yugipedia-set-pages",
        "ygoprodeck-api"
      ]
    },
    {
      "territory": "tcg-eu",
      "date": "2008-03-12",
      "precision": "day",
      "status": "reported",
      "kind": "retail",
      "sources": [
        "yugipedia-set-pages",
        "ygoprodeck-api"
      ]
    }
  ],
  "printings": [
    {
      "passcode": 5640330,
      "name": "Hannibal Necromancer",
      "numbers": [
        "PTDN-ENSE2"
      ]
    },
    {
      "passcode": 11508758,
      "name": "Mutant Mindmaster",
      "numbers": [
        "PTDN-ENSE1"
      ]
    }
  ],
  "sources": [
    "ygoprodeck-api",
    "yugipedia-set-pages"
  ],
  "notes": "Dates from Yugipedia set page 'Phantom Darkness: Special Edition'; printings from the YGOPRODeck bulk dump."
}
